{
  "schema_version": "major-map-llm-v1",
  "map_id": "map_f766aee42e826d51",
  "source": {
    "pdf_path": "data/maps/source_pdfs/2024-2025/map_f766aee42e826d51.pdf",
    "pdf_url": "https://sc.edu/about/offices_and_divisions/advising/documents/major_maps/2024-2025/2024_middle-ed-ba-math-engl_map.pdf",
    "sha256": "60569d92fe137844227b1a6b5d59e3ed7de20db6d3758a4d2c7ffefdc368e25e",
    "page_count": 2,
    "catalog_year": "2024-2025"
  },
  "program": {
    "major": "Middle Level Education",
    "degree_name": "Bachelor of Arts (B.A.)",
    "degree_abbreviation": "B.A.",
    "college": "Education",
    "department": "Instruction & Teacher Education",
    "total_credits": {
      "minimum": 122,
      "maximum": 122
    },
    "concentrations": [],
    "evidence": [
      {
        "page": 1,
        "quote": "Middle Level Education",
        "region": "header"
      }
    ]
  },
  "plan": {
    "format": "four_year",
    "semesters": [
      {
        "number": 1,
        "label": "Semester One",
        "academic_year": 1,
        "term": "fall",
        "credits": {
          "minimum": 15,
          "maximum": 15
        },
        "requirements": [
          {
            "id": "semester-1-requirement-1",
            "sequence": 1,
            "label": "ENGL 101 Critical Reading and Composition",
            "source_text": "ENGL 101 Critical Reading and Composition 3 C CC-CMW",
            "credits": {
              "minimum": 3,
              "maximum": 3
            },
            "critical": false,
            "minimum_grade": "C",
            "requirement_codes": [
              "CC-CMW"
            ],
            "rule": {
              "type": "course",
              "subject": "ENGL",
              "number": "101"
            },
            "evidence": [
              {
                "page": 1,
                "quote": "ENGL 101 Critical Reading and Composition 3 C CC-CMW",
                "region": "Semester One"
              }
            ],
            "confidence": 0.95,
            "review_flags": []
          },
          {
            "id": "semester-1-requirement-2",
            "sequence": 2,
            "label": "Carolina Core ARP Requirement3",
            "source_text": "Carolina Core ARP Requirement3 3 CC-ARP",
            "credits": {
              "minimum": 3,
              "maximum": 3
            },
            "critical": false,
            "minimum_grade": null,
            "requirement_codes": [
              "CC-ARP"
            ],
            "rule": {
              "type": "attribute",
              "code": "CC-ARP",
              "label": "Carolina Core ARP Requirement3"
            },
            "evidence": [
              {
                "page": 1,
                "quote": "Carolina Core ARP Requirement3 3 CC-ARP",
                "region": "Semester One"
              }
            ],
            "confidence": 0.6,
            "review_flags": [
              "footnote_dependency"
            ]
          },
          {
            "id": "semester-1-requirement-3",
            "sequence": 3,
            "label": "Carolina Core AIU Requirement3",
            "source_text": "Carolina Core AIU Requirement3 3 CC-AIU",
            "credits": {
              "minimum": 3,
              "maximum": 3
            },
            "critical": false,
            "minimum_grade": null,
            "requirement_codes": [
              "CC-AIU"
            ],
            "rule": {
              "type": "attribute",
              "code": "CC-AIU",
              "label": "Carolina Core AIU Requirement3"
            },
            "evidence": [
              {
                "page": 1,
                "quote": "Carolina Core AIU Requirement3 3 CC-AIU",
                "region": "Semester One"
              }
            ],
            "confidence": 0.6,
            "review_flags": [
              "footnote_dependency"
            ]
          },
          {
            "id": "semester-1-requirement-4",
            "sequence": 4,
            "label": "Carolina Core GHS Course",
            "source_text": "Carolina Core GHS Course 3 CC-GHS",
            "credits": {
              "minimum": 3,
              "maximum": 3
            },
            "critical": false,
            "minimum_grade": null,
            "requirement_codes": [
              "CC-GHS"
            ],
            "rule": {
              "type": "attribute",
              "code": "CC-GHS",
              "label": "Carolina Core GHS Course"
            },
            "evidence": [
              {
                "page": 1,
                "quote": "Carolina Core GHS Course 3 CC-GHS",
                "region": "Semester One"
              }
            ],
            "confidence": 0.6,
            "review_flags": []
          },
          {
            "id": "semester-1-requirement-5",
            "sequence": 5,
            "label": "Elective (UNIV 101 The Student in the University)",
            "source_text": "Elective (UNIV 101 The Student in the University) 3 PR/CC (GFL)",
            "credits": {
              "minimum": 3,
              "maximum": 3
            },
            "critical": false,
            "minimum_grade": null,
            "requirement_codes": [
              "PR",
              "CC"
            ],
            "rule": {
              "type": "course",
              "subject": "UNIV",
              "number": "101"
            },
            "evidence": [
              {
                "page": 1,
                "quote": "Elective (UNIV 101 The Student in the University) 3 PR/CC (GFL)",
                "region": "Semester One"
              }
            ],
            "confidence": 0.6,
            "review_flags": []
          }
        ]
      },
      {
        "number": 2,
        "label": "Semester Two",
        "academic_year": 1,
        "term": "spring",
        "credits": {
          "minimum": 16,
          "maximum": 16
        },
        "requirements": [
          {
            "id": "semester-2-requirement-1",
            "sequence": 1,
            "label": "ENGL 102 Rhetoric and Composition",
            "source_text": "ENGL 102 Rhetoric and Composition 3 C CC-CMW C or better in ENGL 101",
            "credits": {
              "minimum": 3,
              "maximum": 3
            },
            "critical": false,
            "minimum_grade": "C",
            "requirement_codes": [
              "CC-CMW"
            ],
            "rule": {
              "type": "course",
              "subject": "ENGL",
              "number": "102"
            },
            "evidence": [
              {
                "page": 1,
                "quote": "ENGL 102 Rhetoric and Composition 3 C CC-CMW C or better in ENGL 101",
                "region": "Semester Two"
              }
            ],
            "confidence": 0.95,
            "review_flags": []
          },
          {
            "id": "semester-2-requirement-2",
            "sequence": 2,
            "label": "Carolina Core ARP Requirement3",
            "source_text": "Carolina Core ARP Requirement3 3 CC-ARP",
            "credits": {
              "minimum": 3,
              "maximum": 3
            },
            "critical": false,
            "minimum_grade": null,
            "requirement_codes": [
              "CC-ARP"
            ],
            "rule": {
              "type": "attribute",
              "code": "CC-ARP",
              "label": "Carolina Core ARP Requirement3"
            },
            "evidence": [
              {
                "page": 1,
                "quote": "Carolina Core ARP Requirement3 3 CC-ARP",
                "region": "Semester Two"
              }
            ],
            "confidence": 0.6,
            "review_flags": [
              "footnote_dependency"
            ]
          },
          {
            "id": "semester-2-requirement-3",
            "sequence": 3,
            "label": "Carolina Core GSS Requirement3 (and/or Foreign language4)",
            "source_text": "Carolina Core GSS Requirement3 (and/or Foreign language4) 3 CC-GSS (GFL)",
            "credits": {
              "minimum": 3,
              "maximum": 3
            },
            "critical": false,
            "minimum_grade": null,
            "requirement_codes": [
              "CC-GSS"
            ],
            "rule": {
              "type": "attribute",
              "code": "CC-GSS",
              "label": "Carolina Core GSS Requirement3 (and/or Foreign language4)"
            },
            "evidence": [
              {
                "page": 1,
                "quote": "Carolina Core GSS Requirement3 (and/or Foreign language4) 3 CC-GSS (GFL)",
                "region": "Semester Two"
              }
            ],
            "confidence": 0.6,
            "review_flags": []
          },
          {
            "id": "semester-2-requirement-4",
            "sequence": 4,
            "label": "Carolina Core SCI Requirement 3",
            "source_text": "Carolina Core SCI Requirement 3 4 CC-SCI",
            "credits": {
              "minimum": 4,
              "maximum": 4
            },
            "critical": false,
            "minimum_grade": null,
            "requirement_codes": [
              "CC-SCI"
            ],
            "rule": {
              "type": "attribute",
              "code": "CC-SCI",
              "label": "Carolina Core SCI Requirement 3"
            },
            "evidence": [
              {
                "page": 1,
                "quote": "Carolina Core SCI Requirement 3 4 CC-SCI",
                "region": "Semester Two"
              }
            ],
            "confidence": 0.6,
            "review_flags": []
          },
          {
            "id": "semester-2-requirement-5",
            "sequence": 5,
            "label": "EDTE 201 Issues & Trends in Teaching & Learning",
            "source_text": "EDTE 201 Issues & Trends in Teaching & Learning 3 C * MR",